{
  "$schema": "http://json-schema.org/draft-07/schema#",
  "title": "Weapons",
  "type": "array",
  "items": {
    "type": "object",
    "properties": {
      "name": { "type": "string" },
      "type": {
        "type": "string",
        "enum": ["Sword", "Lance", "Axe", "Bow", "Tome", "Light", "Staff", "Scroll", "Breath"]
      },
      "tier": {
        "type": "string",
        "enum": ["Iron", "Steel", "Silver", "Legend", "Rare", "Epic"]
      },
      "rankRequired": {
        "type": "string",
        "enum": ["Prof", "Mast"]
      },
      "might": { "type": "integer", "minimum": 0 },
      "hit": { "type": "integer", "minimum": 0 },
      "crit": { "type": "integer", "minimum": 0 },
      "weight": { "type": "integer", "minimum": 0 },
      "range": { "type": "string", "pattern": "^\\d+(-\\d+)?$" },
      "special": { "type": "string" },
      "price": { "type": "integer", "minimum": 0 },
      "descentOnly": {
        "type": "boolean",
        "description": "Act V's alone (engine/DescentSwitch.js): the Compendium leaves it out while the Descent is off."
      },
      "healBase": { "type": "integer" },
      "uses": { "type": "integer", "minimum": 1 },
      "perBattleUses": { "type": "boolean" },
      "usesByFaction": {
        "type": "object",
        "properties": {
          "player": { "type": "integer", "minimum": 1 },
          "enemy": { "type": "integer", "minimum": 1 }
        },
        "additionalProperties": false
      },
      "healAll": { "type": "boolean" },
      "rangeBonuses": {
        "type": "array",
        "items": {
          "type": "object",
          "properties": {
            "mag": { "type": "integer" },
            "bonus": { "type": "integer" }
          },
          "required": ["mag", "bonus"],
          "additionalProperties": false
        }
      },
      "useBonuses": {
        "type": "array",
        "items": {
          "type": "object",
          "properties": {
            "mag": { "type": "integer" },
            "bonus": { "type": "integer" }
          },
          "required": ["mag", "bonus"],
          "additionalProperties": false
        }
      },
      "maxUses": { "type": "integer", "minimum": 1 },
      "statusEffect": { "type": "string" },
      "cureConditions": { "type": "boolean" },
      "relocate": {
        "type": "string",
        "enum": ["rescue", "warp"]
      },
      "skillId": { "type": "string" },
      "weaponArtIds": { "type": "array", "items": { "type": "string" } },
      "weaponArtSources": { "type": "array", "items": { "type": "string" } },
      "teachesWeaponArtId": { "type": "string" },
      "allowedWeaponTypes": { "type": "array", "items": { "type": "string" } },
      "lore": { "type": "string", "minLength": 1 },
      "signatureOf": { "type": "string", "minLength": 1 },
      "trophyOf": { "type": "string", "minLength": 1 },
      "rules": {
        "type": "array",
        "description": "Epic weapons' rules (engine/EpicWeapons.js validateWeaponRules checks each kind's keys).",
        "items": {
          "type": "object",
          "properties": { "kind": { "type": "string" } },
          "required": ["kind"]
        }
      }
    },
    "required": [
      "name",
      "type",
      "tier",
      "rankRequired",
      "might",
      "hit",
      "crit",
      "weight",
      "range",
      "special",
      "price"
    ],
    "additionalProperties": false
  }
}
