[
  {
    "name": "Iron Sword",
    "lore": "Stamped VAREN by the guard, same as your father's. Same as his father's.",
    "type": "Sword",
    "tier": "Iron",
    "rankRequired": "Prof",
    "might": 5,
    "hit": 95,
    "crit": 0,
    "weight": 3,
    "range": "1",
    "special": "",
    "price": 500
  },
  {
    "name": "Steel Sword",
    "lore": "Req.: Varen pattern. Delivered: whatever the forge had hot. Signed, under protest.",
    "type": "Sword",
    "tier": "Steel",
    "rankRequired": "Prof",
    "might": 8,
    "hit": 85,
    "crit": 0,
    "weight": 5,
    "range": "1",
    "special": "",
    "price": 1000
  },
  {
    "name": "Rapier",
    "lore": "'Too thin for a knight in plate.' 'Tell the knight. And the horse.'",
    "type": "Sword",
    "tier": "Steel",
    "rankRequired": "Prof",
    "might": 6,
    "hit": 95,
    "crit": 5,
    "weight": 2,
    "range": "1",
    "special": "Effective vs Armored/Cavalry (2x)",
    "price": 1800,
    "signatureOf": "Edric"
  },
  {
    "name": "Silver Sword",
    "lore": "Silver over a steel core. Hilt rewrapped four times; the blade never needed it.",
    "type": "Sword",
    "tier": "Silver",
    "rankRequired": "Prof",
    "might": 11,
    "hit": 90,
    "crit": 0,
    "weight": 4,
    "range": "1",
    "special": "",
    "price": 2000
  },
  {
    "name": "Keen Sword",
    "lore": "Provincial surgeons call it the Short Shift. They don't mean their own work.",
    "type": "Sword",
    "tier": "Silver",
    "rankRequired": "Prof",
    "might": 8,
    "hit": 85,
    "crit": 30,
    "weight": 5,
    "range": "1",
    "special": "Critical specialist",
    "price": 2300
  },
  {
    "name": "Jian",
    "lore": "Straight and double-edged, a red tassel at the pommel. It came up the river trade.",
    "type": "Sword",
    "tier": "Steel",
    "rankRequired": "Prof",
    "might": 5,
    "hit": 95,
    "crit": 35,
    "weight": 4,
    "range": "1",
    "special": "Critical specialist",
    "price": 1300
  },
  {
    "name": "Gust Blade",
    "lore": "Swing at the second rank, soldier. The wind it cuts loose gets there before you.",
    "type": "Sword",
    "tier": "Steel",
    "rankRequired": "Prof",
    "might": 3,
    "hit": 85,
    "crit": 0,
    "weight": 7,
    "range": "1-2",
    "special": "Wind gust at range, lower stats",
    "price": 1200
  },
  {
    "name": "Gale Blade",
    "lore": "Every swing throws a gale. Its owners have stopped apologizing for the noise.",
    "type": "Sword",
    "tier": "Silver",
    "rankRequired": "Prof",
    "might": 6,
    "hit": 80,
    "crit": 0,
    "weight": 8,
    "range": "1-2",
    "special": "Wind gust at range, lower stats",
    "price": 2200
  },
  {
    "name": "Lancehook",
    "lore": "Catch the lance on the crossguard. Walk up it. Say good morning.",
    "type": "Sword",
    "tier": "Steel",
    "rankRequired": "Prof",
    "might": 8,
    "hit": 85,
    "crit": 0,
    "weight": 6,
    "range": "1",
    "special": "Reverses weapon triangle",
    "price": 1300
  },
  {
    "name": "Oathblade",
    "lore": "The chronicle credits its champion with one stroke at the bridge. Two men fell.",
    "type": "Sword",
    "tier": "Legend",
    "rankRequired": "Mast",
    "might": 15,
    "hit": 85,
    "crit": 20,
    "weight": 8,
    "range": "1",
    "special": "",
    "weaponArtIds": [
      "legend_phantom_rush"
    ],
    "weaponArtSources": [
      "innate"
    ],
    "price": 0
  },
  {
    "name": "Thunderbrand",
    "lore": "A storm lives where the fuller should be. Sheathed, it still lifts your hair.",
    "type": "Sword",
    "tier": "Silver",
    "rankRequired": "Prof",
    "might": 8,
    "hit": 90,
    "crit": 5,
    "weight": 5,
    "range": "1-2",
    "special": "Magic sword: uses MAG, targets RES",
    "price": 2200
  },
  {
    "name": "Twinsworn",
    "lore": "Forged for twin princes who would share nothing, it learned to strike for both.",
    "type": "Sword",
    "tier": "Legend",
    "rankRequired": "Mast",
    "might": 11,
    "hit": 95,
    "crit": 5,
    "weight": 6,
    "range": "1",
    "special": "Attacks twice consecutively",
    "weaponArtIds": [
      "legend_gemini_tempest"
    ],
    "weaponArtSources": [
      "innate"
    ],
    "price": 0
  },
  {
    "name": "Iron Lance",
    "lore": "Dear Mam, they gave me a lance and a hat. The hat is the better fit.",
    "type": "Lance",
    "tier": "Iron",
    "rankRequired": "Prof",
    "might": 6,
    "hit": 85,
    "crit": 0,
    "weight": 5,
    "range": "1",
    "special": "",
    "price": 500
  },
  {
    "name": "Steel Lance",
    "lore": "Steel heads, 300. Ash shafts, 300. Heads fitted to shafts: see next quarter.",
    "type": "Lance",
    "tier": "Steel",
    "rankRequired": "Prof",
    "might": 9,
    "hit": 75,
    "crit": 0,
    "weight": 8,
    "range": "1",
    "special": "",
    "price": 1000
  },
  {
    "name": "Silver Lance",
    "lore": "Old-kingdom gate silver, meant to catch torchlight at parades. The war disagreed.",
    "type": "Lance",
    "tier": "Silver",
    "rankRequired": "Prof",
    "might": 12,
    "hit": 80,
    "crit": 0,
    "weight": 7,
    "range": "1",
    "special": "",
    "price": 2000
  },
  {
    "name": "Javelin",
    "lore": "Third rank, over the shields, on my count. Not your count. MY count.",
    "type": "Lance",
    "tier": "Iron",
    "rankRequired": "Prof",
    "might": 4,
    "hit": 70,
    "crit": 0,
    "weight": 6,
    "range": "1-2",
    "special": "Throwable, lower stats",
    "price": 700
  },
  {
    "name": "Axehook",
    "lore": "Hook the axe by its beard and pull. Axemen on the border spit at the sight of it.",
    "type": "Lance",
    "tier": "Steel",
    "rankRequired": "Prof",
    "might": 9,
    "hit": 70,
    "crit": 0,
    "weight": 9,
    "range": "1",
    "special": "Reverses weapon triangle",
    "price": 1300
  },
  {
    "name": "Oathlance",
    "lore": "At the ford, the chronicle says, each rider struck twice and the river ran slow.",
    "type": "Lance",
    "tier": "Legend",
    "rankRequired": "Mast",
    "might": 10,
    "hit": 75,
    "crit": 0,
    "weight": 11,
    "range": "1",
    "special": "Attacks twice consecutively",
    "weaponArtIds": [
      "legend_piercing_charge"
    ],
    "weaponArtSources": [
      "innate"
    ],
    "price": 0
  },
  {
    "name": "Doomblade",
    "lore": "The chronicles name this lance once and never again.",
    "type": "Lance",
    "tier": "Legend",
    "rankRequired": "Mast",
    "might": 12,
    "hit": 85,
    "crit": 5,
    "weight": 8,
    "range": "1-2",
    "special": "",
    "weaponArtIds": [
      "legend_doom_thrust"
    ],
    "weaponArtSources": [
      "innate"
    ],
    "price": 0
  },
  {
    "name": "Gae Bolg",
    "lore": "Named for a hero who never started a fight, and never lost one.",
    "type": "Lance",
    "tier": "Legend",
    "rankRequired": "Mast",
    "might": 14,
    "hit": 85,
    "crit": 5,
    "weight": 9,
    "range": "1",
    "special": "+5 STR when counterattacking",
    "weaponArtIds": [
      "legend_blood_lance"
    ],
    "weaponArtSources": [
      "innate"
    ],
    "price": 0
  },
  {
    "name": "Iron Axe",
    "lore": "Bark still on the haft. Somebody's woodpile is going to be short this winter.",
    "type": "Axe",
    "tier": "Iron",
    "rankRequired": "Prof",
    "might": 7,
    "hit": 80,
    "crit": 0,
    "weight": 6,
    "range": "1",
    "special": "",
    "price": 500
  },
  {
    "name": "Steel Axe",
    "lore": "Steel axe. Heavy. Cheap. Always in stock. Don't ask why it's always in stock.",
    "type": "Axe",
    "tier": "Steel",
    "rankRequired": "Prof",
    "might": 10,
    "hit": 70,
    "crit": 0,
    "weight": 9,
    "range": "1",
    "special": "",
    "price": 1000
  },
  {
    "name": "Silver Axe",
    "lore": "Hung above a clan hearth for six generations. Taken down, at last, for work.",
    "type": "Axe",
    "tier": "Silver",
    "rankRequired": "Prof",
    "might": 13,
    "hit": 75,
    "crit": 0,
    "weight": 8,
    "range": "1",
    "special": "",
    "price": 2000
  },
  {
    "name": "Hatchet",
    "lore": "'Did you throw your axe again?' 'Threw it well. Fetching it's the hard part.'",
    "type": "Axe",
    "tier": "Steel",
    "rankRequired": "Prof",
    "might": 8,
    "hit": 65,
    "crit": 0,
    "weight": 10,
    "range": "1-2",
    "special": "Throwable, lower stats",
    "price": 1000
  },
  {
    "name": "Keen Axe",
    "lore": "Its bit is ground well past regulation. So, usually, is whoever carries it.",
    "type": "Axe",
    "tier": "Silver",
    "rankRequired": "Prof",
    "might": 10,
    "hit": 75,
    "crit": 30,
    "weight": 8,
    "range": "1",
    "special": "Critical specialist",
    "price": 2300
  },
  {
    "name": "Hammer",
    "lore": "Not at the man. At the plate. The man comes out on his own.",
    "type": "Axe",
    "tier": "Steel",
    "rankRequired": "Prof",
    "might": 12,
    "hit": 65,
    "crit": 0,
    "weight": 10,
    "range": "1",
    "special": "Effective vs Armored (3x)",
    "price": 1300
  },
  {
    "name": "Bladehook",
    "lore": "Burned into the haft: YES, THE WRONG WAY ROUND. ON PURPOSE.",
    "type": "Axe",
    "tier": "Steel",
    "rankRequired": "Prof",
    "might": 10,
    "hit": 65,
    "crit": 0,
    "weight": 10,
    "range": "1",
    "special": "Reverses weapon triangle",
    "price": 1300
  },
  {
    "name": "Oathaxe",
    "lore": "Dug from a barrow holding one king and two sets of armor. It swings for both.",
    "type": "Axe",
    "tier": "Legend",
    "rankRequired": "Mast",
    "might": 11,
    "hit": 70,
    "crit": 0,
    "weight": 13,
    "range": "1",
    "special": "Attacks twice consecutively",
    "weaponArtIds": [
      "legend_galeforce_assault"
    ],
    "weaponArtSources": [
      "innate"
    ],
    "price": 0
  },
  {
    "name": "Tidebreaker",
    "lore": "It held the clan pass when the empire came up like a tide. The tide went back.",
    "type": "Axe",
    "tier": "Legend",